{
  "msgId": "msg_44444444-4444-4444-8444-444444444444",
  "type": "physical_validation",
  "author": "physical_validator",
  "workflowId": "wf_22222222-2222-4222-8222-222222222222",
  "index": 3,
  "status": "success",
  "history": [],
  "planId": "plan_33333333-3333-4333-8333-333333333333",
  "result": "blocked",
  "stepResults": [
    {
      "stepId": "step_001",
      "executable": true,
      "checks": ["分装能力已登记"],
      "blockers": []
    },
    {
      "stepId": "step_002",
      "executable": false,
      "checks": ["运输链路存在"],
      "blockers": ["VD10工位坐标尚未完成现场标定"]
    }
  ],
  "timestamp": 1789196379000
}
